{
    "$schema": "https://json-schema.org/draft/2020-12/schema",
    "$id": "https://delta-v-beyond-sector-3-26/schema/ship",
    "title": "Base ship template",
    "description": "AGENTS: before modifying this schema, read AGENTS.md at the repository root.\n\nDefines common ship properties shared by all ship types. Physical quantities follow ADR-0008 (value+unit objects). Allowed units are defined in the central units registry (assets/json/schema/units.schema.json).",
    "type": "object",
    "additionalProperties": false,
    "required": [
        "entity_type",
        "propulsion",
        "bounding_box",
        "collision_shape",
        "max_weapons_count",
        "max_propulsions_count"
    ],
    "properties": {
        "entity_type": {
            "description": "Entity type discriminator. Must be 'ship'.",
            "type": "string",
            "const": "ship"
        },
        "inertia_scale": {
            "description": "Dimensionless multiplier on the default spherical inertia tensor. 1.0 = sphere with radius 1m. Higher values simulate mass concentrated farther from center.",
            "type": "number",
            "exclusiveMinimum": 0.0,
            "default": 1.0
        },
        "bounding_box": {
            "description": "Axis-aligned bounding box of the mesh in ship-local coordinates (metres). Computed once from glTF mesh. Used for camera position defaults, debug axes, and spatial calculations. Min and max are opposite corners of the box.",
            "type": "object",
            "additionalProperties": false,
            "required": [
                "min",
                "max"
            ],
            "properties": {
                "min": {
                    "description": "Minimum corner (x, y, z in metres).",
                    "$ref": "https://delta-v-beyond-sector-3-26/schema/common#/$defs/vec3"
                },
                "max": {
                    "description": "Maximum corner (x, y, z in metres).",
                    "$ref": "https://delta-v-beyond-sector-3-26/schema/common#/$defs/vec3"
                }
            }
        },
        "propulsion": {
            "description": "Propulsion system configuration. References main thruster and maneuvering thruster definitions by name. Required per ADR-0014 (gameplay values in JSON).",
            "type": "object",
            "additionalProperties": false,
            "required": [
                "main_thrusters",
                "maneuvering_thruster"
            ],
            "properties": {
                "main_thrusters": {
                    "description": "Array of main thruster names (references to directories under assets/components/propulsion/main-thrusters/). For M2, exactly one thruster is active. In M3+, the player can switch between thrusters (e.g. cruise vs. combat mode).",
                    "type": "array",
                    "minItems": 1,
                    "items": {
                        "type": "string"
                    }
                },
                "maneuvering_thruster": {
                    "description": "Name of the maneuvering thruster (reference to a directory under assets/components/propulsion/maneuvering-thrusters/).",
                    "type": "string"
                }
            }
        },
        "collision_shape": {
            "description": "Collision shape for the ship. Defines how it interacts with other objects. Derived from bounding_box per ADR-0044.",
            "type": "object",
            "additionalProperties": false,
            "required": [
                "type"
            ],
            "properties": {
                "type": {
                    "description": "Collision shape type. 'sphere' or 'box' are supported for M3.",
                    "type": "string",
                    "enum": [
                        "sphere",
                        "box"
                    ]
                },
                "radius": {
                    "description": "Radius of the sphere in metres (for sphere shape type).",
                    "$ref": "https://delta-v-beyond-sector-3-26/schema/units#/$defs/length"
                },
                "half_extents": {
                    "description": "Half-extents of the box (for box shape type).",
                    "$ref": "https://delta-v-beyond-sector-3-26/schema/common#/$defs/vec3"
                },
                "offset": {
                    "description": "Offset of the collision shape center from the entity origin in metres. Default (0,0,0) centers the collision shape on the entity. Use this to align the collision shape with the visual mesh when the mesh is not centered at the entity origin.",
                    "$ref": "https://delta-v-beyond-sector-3-26/schema/common#/$defs/vec3",
                    "default": {
                        "x": {
                            "value": 0,
                            "unit": "m"
                        },
                        "y": {
                            "value": 0,
                            "unit": "m"
                        },
                        "z": {
                            "value": 0,
                            "unit": "m"
                        }
                    }
                }
            }
        },
        "weapons": {
            "description": "Array of weapon names. Each entry references a weapon definition by name.",
            "type": "array",
            "items": {
                "type": "string"
            },
            "default": []
        },
        "max_weapons_count": {
            "description": "Maximum number of weapons this ship can carry. Used to limit weapon selection keys. Required field - no default.",
            "type": "integer",
            "minimum": 0,
            "maximum": 10
        },
        "max_propulsions_count": {
            "description": "Maximum number of main thrusters this ship can switch between. Used to limit propulsion selection keys. Minimum is 1 (a ship must have at least one thruster to fly). Required field - no default.",
            "type": "integer",
            "minimum": 1,
            "maximum": 10
        },
        "health": {
            "description": "Ship health in hit points. Required per ADR-0014 (gameplay values in JSON).",
            "$ref": "https://delta-v-beyond-sector-3-26/schema/units#/$defs/damage",
            "default": {
                "value": 100.0,
                "unit": "hp"
            }
        }
    }
}
